Q No.,Question,Answer
312,"অনিস প্রথমে বাংলা ব্যঞ্জনবর্ণ শেখার সাথে শুরু করে। অনিস যদি একটি বর্ণমালা শিখতে ৮ দিন সময় নেয়, তাহলে অনিসের সব ব্যঞ্জনবর্ণ শেখা শেষ করতে কতদিন লাগবে?",৩১২
313,"অনিস যদি একটি বাংলা বর্ণমালা শিখতে ৩ দিন সময় নেয়, তাহলে অনিসের সব বর্ণমালা শেখা শেষ করতে কতদিন লাগবে?",১৫০
314,"অনিস যদি একটি বাংলা বর্ণমালা শিখতে ৬ দিন সময় নেয়, তাহলে অনিসের সব বর্ণমালা শেখা শেষ করতে কতদিন লাগবে?",৩০০
315,"অলিভার অন্যদের কাছে যাওয়ার আগে প্রথমে বাংলা স্বরবর্ণ শেখার সাথে শুরু করে। অলিভার যদি একটি বর্ণমালা শিখতে ৫ দিন সময় নেয়, তাহলে অলিভারের কত দিন সব স্বরবর্ণ শেখা শেষ করতে হবে?",৫৫
316,"জেনেসিস কর্মক্ষেত্রে একটি নতুন প্রকল্পের নেতৃত্ব দিচ্ছিল। সুতরাং, প্রকল্পটি শেষ করতে তিনি ২ সপ্তাহ ধরে প্রতিদিন ৪ ঘন্টা কাজ করেছেন। জেনেসিস এই সময়ের মধ্যে কত ঘন্টা কাজ করেছিল?",৫৬
317,একটি খামারে ১১টি পশু রয়েছে। ১১টি প্রাণীর মধ্যে ৬টি হাঁস এবং বাকিগুলি কুকুর। খামারে কয়টি পশুর পা আছে?,৩২
318,"ভিক্টোরিয়া একটি প্রদর্শনীতে রাখা সমস্ত বাণিজ্যিক বিমানের ডানা গণনা করেছিল। মোট ডানা ৫০টি হলে, কতটি প্লেন ছিল?",২৫
319,"সনি ১৭ বছর বয়সে সনির জন্মদিনে একটি প্রতিষ্ঠানকে ৮ হাজার টাকা দান করা শুরু করে। গতকাল, সনি ৭১ বছর বয়সী হয়। এখন পর্যন্ত সনি কত হাজার টাকা দান করেছে?",৪৪০
320,জন গত সোমবার থেকে প্রতিদিন সকালে দৌড়ানোর সিদ্ধান্ত নিয়েছে এবং সোমবার ১৭০০ মিটার দৌড়েছে। শনিবার রাতে জন দুর্ঘটনায় আহত না হওয়া পর্যন্ত জন প্রতিদিন সকালে একই দূরত্ব দৌড়ায়। জন মোট কত রান করেছেন?,১০২০০
321,কবীর একটি রঙের বাক্স কিনেছিলেন যাতে রংধনুর প্রতিটি রঙের সাথে সঙ্গতিপূর্ণ পেন্সিল রয়েছে। কবীরের ৫ জন বন্ধুও একই রঙের বাক্স কিনেছে। তাদের মোট কত পেন্সিল আছে?,৪২
322,ইথান এবং আরিয়ানা এক কিমি লম্বা দৌড়ে দৌড়াচ্ছেন। আরিয়ানা যখন স্টার্ট লাইন থেকে ১৮৪ মিটার দূরে ছিল তখন ইথান রেস শেষ করেন। ইথান এবং আরিয়ানা কত মিটার দূরে ছিল?,৮১৬
323,মারিয়া এবং সোনিয়া দাবা খেলার সিদ্ধান্ত নিয়েছে কিন্তু ৪ টি গুটি ছিল না। কতটি গুটি উপস্থিত ছিল?,২৮
324,"আরিয়ানা কর্মক্ষেত্রে ৬ ঘন্টা, অন্যান্য দৈনন্দিন কাজে ৫ ঘন্টা ব্যয় করে এবং দিনের অবশিষ্ট সময় ঘুমায়। আরিয়ানা দিনে কত ঘন্টা ঘুমায়?",১৩
325,তাসের ডেক থেকে ৪টি কালো কার্ড বের করা হয়েছে। অবশিষ্ট কালো কার্ডের সংখ্যা কত?,২২
326,"মাসের শেষে, মেডেলিন তার মে মাসের খরচ হিসাব করছিলেন। তিনি দেখতে পান যে তিনি পিজ্জার জন্য মোট ৪৬৫ টাকা ব্যয় করেছেন। যদি ম্যাডেলিন প্রতিদিন সমান সংখ্যক পিজ্জা খায়, তবে সে প্রতিদিন কত টাকার পিজ্জা খায়?",১৫
327,একজন মানুষ তার প্রতিটি হাতে একটি করে বাক্স তুলতে পারে। ১০ জনের একটি দল মোট কতটি বাক্স রাখতে পারে?,২০
328,ভোর ৫টায় বোস্টন থেকে যাত্রা শুরু করে সন্ধ্যা ৮টায় শিকাগো পৌঁছাই। আমি কত ঘন্টা ভ্রমণ করেছি?,১৫
329,জ্যাক এপ্রিল মাসে একটি স্কুলের প্রধান শিক্ষক হন। জ্যাক একই বছরের আগস্টে অবসর নেন। কত মাস তিনি প্রধান শিক্ষক ছিলেন?,৪
330,জানুয়ারি মাসে একটি স্কুলের প্রধান শিক্ষক হন রুবি। একই বছর জুন মাসে অবসর নেন রুবি। কত মাস তিনি প্রধান শিক্ষক ছিলেন?,৫
331,যদি একটি দেয়াল ঘড়ি সমান বিরতিতে দিনে ৬ বার বেজে ওঠে। কত ঘন্টা পর পর ঘড়িটি বেজে ওঠে?,৪
332,একটি নির্দিষ্ট প্রজাতির উদ্ভিদের উচ্চতা প্রতি দশকে ৯০ মিটার বৃদ্ধি পায়। ২ শতাব্দীতে মোট কত মিটার উচ্চতা বৃদ্ধি পাবে?,১৮০০
333,আলেক্সা সকাল ৫ টায় তার ল্যাবে পৌঁছেছিল এবং ল্যাবে ১৩ ঘন্টা কাটিয়েছিল। আলেক্সা কখন ল্যাব থেকে সন্ধ্যায় ফিরে এসেছে?,৬
334,করিম তার ১৪ জোড়া জুতা পরিবর্তন করতে চায়। যদি পরিবর্তনের খরচ হয় ৩৭ টাকা প্রতি জুতা। করিমকে কত টাকা দিতে হবে ?,১০৩৬
335,আদ্রিয়ান প্রতি মাসে ৪ বার কাজ থেকে একদিন করে ছুটি নেন। আদ্রিয়ান সারা বছরে কত ছুটি নিয়েছে?,৪৮
336,লিয়ার একটি কাজ থেকে প্রতিদিন ৬০ টাকা পায়। ৪ সপ্তাহে লিয়া দ্বারা কত টাকা আয় করবে?,১৬৮০
337,এমিলি প্রতি মাসে দুবার কাজ থেকে একদিন করে ছুটি নেন। সারা বছরে এমিলি কত ছুটি নিয়েছিল?,২৪
338,"স্টেডিয়ামের প্রবেশপথে বিশাল সংখ্যক প্ল্যাকার্ড একটি বিশাল ঝুড়িতে রাখা হয়। স্টেডিয়ামে প্রবেশকারী প্রত্যেক ব্যক্তি প্রতিটি হাতে একটি করে প্ল্যাকার্ড সংগ্রহ করে। বিকেল ৩টায় স্টেডিয়ামে প্রবেশ করতে শুরু করে মানুষ। কয়েক মিনিট পরে, লোকেরা অভিযোগ করে যে ঝুড়িটি খালি এবং আর কোনও প্ল্যাকার্ড নেই। যদি ঝুড়িটি ৬৪৫০টি প্ল্যাকার্ড রাখতে পারে এবং এটি শুরুতে পূর্ণ ছিল, তবে সেই সময় পর্যন্ত কত লোক স্টেডিয়ামে প্রবেশ করেছে?",৩২২৫
339,"জেডেন একটি প্রদর্শনীতে রাখা সমস্ত বিমানের পাখা গণনা করেছে। মোট পাখা ১০৮টি হলে, কতটি প্লেন ছিল?",৫৪
340,আশির ২২ মি/সেকেন্ড গতিতে চলে সে ৫ মিনিটে কত মিটার অতিক্রম করতে পারে,৬৬০০
341,জোস ৩০ মিনিট ফুটবল খেলেন এবং তারপর ৬০ মিনিট বাসকেটবল খেলেন। তিনি কত ঘন্টা খেলেন?,১.৫০
342,প্রতিদিন মিলা তার ফোনে ৬ ঘন্টা ব্যয় করে। এই সময়ের অর্ধেক যদি ব্যয় হয় সোশ্যাল মিডিয়ায়। এক সপ্তাহে তিনি কতটা সময় সোশ্যাল মিডিয়ায় ব্যয় করেন,২১
343,একটি গ্যারেজে ১৮টি বাইকের চাকা রয়েছে। ১৮টি চাকা ব্যবহার করে তিনি কয়টি বাইক একত্র করতে পারেন?,৯
344,"কারিনা ১১ বছর বয়সে জন্মদিনে একটি সংস্থাকে ৭ হাজার টাকা দান করা শুরু করেছিলেন৷ গতকাল, কারিনার ২৯ বছর বয়স হয়৷ কারিনা  এখন পর্যন্ত কত হাজার টাকা দান করেছেন?",১৩৩
345,"পুরো জুন মাসের জন্য, ওয়েন প্রতিদিন ২টি বার্গার কিনেছিলেন। যদি প্রতিটি বার্গারের দাম ১২ টাকা। জুন মাসে ওয়েন বার্গারে কত খরচ করেছেন?",৭২০
346,"জয়ের প্রতি মাসে ২ বার ডাক্তারের কাছে যাওয়ার কথা। সুতরাং, তিনি সারা বছর ধরে প্রতি মাসে ২টি ছুটি নিয়েছিলেন। ঐ বছরে জয় কয়টা ছুটি নিয়েছিল?",২৪
347,"জন একটি বর্ণমালা দিয়ে শুরু করে শব্দ শিখছে। জন প্রথমে ব্যঞ্জনবর্ন শেখার সাথে শুরু করেন। জন যদি একটি বর্ণমালা শিখতে ৪ দিন সময় নেয়, তাহলে জনের সমস্ত ব্যঞ্জনবর্ন শিখতে কত দিন লাগবে?",১৫৬
348,"লুনা হাজার টাকা আয় করেছেন এবং তার ৩১৪ টাকা ঋণ ছিল। তাই, তিনি তার বন্ধুকে ৩১৪ টাকা দিয়েছেন। লুনার এখন কত টাকা আছে?",৬৮৬
349,যদি একটি বর্গক্ষেত্রের প্রতিটি পাশে বেড়া দিতে খরচ হয় ৬৯ টাকা। বেড়ায় মোট কত খরচ হয় বের কর।,২৭৬
350,"এভারেট বুঝতে পারে যে যখনই ঘড়ির কাঁটা ৭টা বাজে, সে একটি ট্রেনে হয় অফিসে যাচ্ছে বা ফিরছে। যদি এভারেট বাড়ি থেকে অফিসে যাওয়ার জন্য ৫ টাকা দেয়, তাহলে এভারেট ১৯ কার্যদিবসের জন্য ভ্রমণে কত খরচ করে?",১৯০
351,এলিজাবেথ এক ডজন কলা কিনেছে। তিনি ৪টি কলা খেয়েছেন। এখন কয়জন বাকি আছে?,৮
352,ইলিয়াস দুই ডজন কলা কিনেছে। তিনি ৩টি কলা খেয়েছেন। এখন কয়জন বাকি আছে?,২১
353,"ম্যাডিসন এমন একটি স্কুলে অধ্যয়ন করেন যেখানে ক্লাস শুরু হলে একবার এবং ক্লাস শেষ হলে আবার বেল বাজে। প্রতি ক্লাসের পর ১৫ মিনিটের বিরতি থাকে। সোমবার, ম্যাডিসনের ক্লাসগুলি হল: গণিত, ইতিহাস, ভূগোল, বিজ্ঞান এবং সঙ্গীত৷ এই মুহূর্তে ম্যাডিসন তার সঙ্গীত ক্লাসে আছে। এতক্ষণে কতবার বেজেছে?",৯
354,"সাভানা ১ মিটার লম্বা একটি রেখা আঁকেন। তারপর তিনি বুঝতে পারলেন যে এটি কিছুটা দীর্ঘ। সুতরাং, তিনি এটির ২৪ সেন্টিমিটার মুছে ফেলেছেন। রেখার দৈর্ঘ্য (সেমি) এখন কত?",৭৬
355,কপিরাইট সমস্যার কারণে এক ঘণ্টার মুভির ১৩ মিনিটের একটি দৃশ্য কেটে ফেলা হয়েছে। সিনেমার চূড়ান্ত দৈর্ঘ্য কত (মিনিটের মধ্যে)?,৪৭
356,হ্যাজেল তার স্ত্রীর প্রতিটি তর্জনীর জন্য একটি সোনার আংটি কিনতে চায়। যদি একটি আংটির দাম ১২ টাকা। হ্যাজেলকে কত টাকা দিতে হবে?,২৪
357,বর্গাকার একটি পার্কের চারপাশে বেড়া দেওয়ায় মোট খরচ ছিল ২৮৮ টাকা। প্রতিটি পাশে বেড়া দিতে কত টাকা খরচ হয়?,৭২
358,সোফি একটি মেডিকেল স্কুলে পড়ছে। সোফি ২ ঘন্টা করে মানবদেহের একেকটি হাড় বিশ্লেষণ করছেন। সোফির কত ঘন্টা বিশ্লেষণ শেষ করতে হবে?,৪১২
359,জোসেফ গত সোমবার থেকে প্রতিদিন সকালে দৌড়ানোর সিদ্ধান্ত নিয়েছিলেন এবং সোমবার ৯০০ মিটার দৌড়েছিলেন। বুধবার রাতে জোসেফ দুর্ঘটনায় আহত না হওয়া পর্যন্ত প্রতিদিন সকালে একই দূরত্ব দৌড়ান। জোসেফ মোট কত রান করেছিলেন?,২৭০০
360,"গ্যাব্রিয়েলা দুপুর ১২টায় স্কুলে যায়। মঙ্গলবার, গ্যাব্রিয়েলার ক্লাসগুলি নিম্নলিখিত ক্রমে হয়: গণিত, ইতিহাস, ভূগোল, বিজ্ঞান এবং সঙ্গীত৷ এইমাত্র গ্যাব্রিয়েলার গণিত ক্লাস শেষ হয়েছে। আপনি কি এখন বিকালের সময় অনুমান করতে পারেন?",১
361,লেভি বোর্ডে প্রতিটি স্বরবর্ণ লিখেছিলেন। যদি প্রতিটি স্বরবর্ণ ৩ বার লেখা হয়। বোর্ডে মোট কতটি বর্ণমালা লেখা ছিল?,৩৩
362,লিওনার্দো একটি চকলেট কিনতে চায়। চকলেটের দাম ৫ টাকা আর লিওনার্দোর পকেটে আছে মাত্র ৪ টাকা। তিনি তার বন্ধুর কাছ থেকে ৫৯ পয়সা ধার নিয়েছিলেন। একটি চকলেট কিনতে লিওনার্দোর এখন আর কত পয়সা লাগবে?,৪১
363,"হাইকিং দলকে প্রত্যেক অংশগ্রহণকারীর জন্য গ্লাভসের ব্যবস্থা করতে হবে। মোট অংশগ্রহণকারীদের সংখ্যা ৮২ হলে, হাইকিং টিমের সর্বনিম্ন কত সংখ্যক গ্লাভস ব্যবস্থা করতে হবে?",১৬৪
364,একটি খামারে ৩২টি প্রাণীর পা এবং মোট ১২টি প্রাণী রয়েছে। কিছু মুরগি আর কিছু গরু। মুরগির সংখ্যা নির্ণয় কর।,৮
365,"ইসাবেলা এমন একটি স্কুলে অধ্যয়ন করে যেখানে একবার ক্লাস শুরু হলে আবার ক্লাস শেষ হলে ঘণ্টা বেজে ওঠে। প্রতি ক্লাসের পর ১৫ মিনিটের বিরতি থাকে। সোমবার, ইসাবেলার ক্লাসগুলি হল: গণিত, ইতিহাস, ভূগোল, বিজ্ঞান এবং সঙ্গীত৷ এই মুহূর্তে ইসাবেলা তার বিজ্ঞান ক্লাসে আছে। এতক্ষণে কতবার বেজেছে?",৭
366,"জোসেফ ভেগাসে বেড়াতে যাচ্ছে। যেহেতু পোকার এবং অন্যান্য তাসের খেলা আজকাল জনপ্রিয় হয়ে উঠেছে, জোসেফ যাত্রার জন্য ৪টি তাসের ডেক রাখার সিদ্ধান্ত নিয়েছে। তার মোট কতটি কার্ড আছে?",২০৮
367,"হাইকিং দলকে প্রত্যেক অংশগ্রহণকারীর জন্য গ্লাভসের ব্যবস্থা করতে হবে। মোট অংশগ্রহণকারীদের সংখ্যা ৬৩ হলে, হাইকিং টিমের সর্বনিম্ন কত সংখ্যক গ্লাভস ব্যবস্থা করতে হবে?",১২৬
368,বর্গাকার একটি পার্কের চারপাশে বেড়া দেওয়ায় মোট খরচ ছিল ২২৪ টাকা। প্রতিটি পাশে বেড়া দিতে কত টাকা খরচ হয়?,৫৬
369,ছেলেদের একটি দল পোকার খেলার সিদ্ধান্ত নিয়েছে এবং ২টি কার্ড দূরে রাখবে। তারা কয়টি তাস নিয়ে খেলছিলো?,৫০
370,স্টেলা এবং কার্টার দাবা খেলার সিদ্ধান্ত নিয়েছিলেন কিন্তু দেখতে পান যে ৮ টি গুটি অনুপস্থিত। কতটি গুটি ছিল?,২৪
371,"লিরা ১৩ বছর বয়সে জন্মদিনে একটি সংস্থাকে ৫ হাজার টাকা দান করা শুরু করে। গতকাল, লিরার ৩৩ বছর বয়স হয়। এখন পর্যন্ত লিরা কত হাজার টাকা দান করেছে?",১০৫
372,আয়ান প্রতিদিন একটি পয়সা সঞ্চয় করতে শুরু করে। কত দিন পর তিনি মোট ৪ টাকা সঞ্চয় করতেন?,৪০০
373,"একটি দোকানে, জেডেন দেখতে পান যে নতুন এবং আকর্ষণীয় ডিজাইনের জুতা বিনামূল্যে পাওয়া যায়। জেডেন সব কিছু নিতে ৩১ সংখ্যক বন্ধু নিয়ে এসেছিল। কত জোড়া জুতা ছিল?",৩২
374,আইভী দেখেন যে তার ঘরে ৪টি মাকড়সা রয়েছে। মাকড়সার পায়ের মোট সংখ্যা কত?,৩২
375,"বিশ্বকাপের উদ্বোধনী অনুষ্ঠানে, সমস্ত দলের অধিনায়ক এবং সহ-অধিনায়কদের আমন্ত্রণ জানানো হয় এবং স্বাগত উপহার দেওয়া হয়। এবারের বিশ্বকাপে ৭টি দল অংশ নিলে এই আসরের জন্য কত উপহারের প্রয়োজন?",১৪
376,হান্টার ৫৫ মিনিট ফুটবল খেলেন এবং তারপর ৫০ মিনিট বাসকেটবল খেলেন। তিনি কত ঘন্টা খেলেন?,১.৭৫
377,অ্যামেলিয়া ৬টি অভিন্ন ঘনকাকৃতির বস্তুর সমস্ত বাইরের তল এঁকেছেন। অ্যামেলিয়ার আঁকা তলের মোট সংখ্যা কত?,৩৬
378,"পোকার এবং অন্যান্য তাসের খেলা আজকাল জনপ্রিয় হয়ে উঠেছে, তাই এলিজা যাত্রার জন্য ৬ ডেক তাস রাখার সিদ্ধান্ত নেন। তার মোট কতটি কার্ড আছে?",৩১২
379,হাত ও পায়ের বুড়ো আঙ্গুলসহ আঙ্গুলের নখ ছেঁটে ফেলতে হবে। একটি নখ কাটা হলে নেইলকাটার একটি বিশেষ ধরনের শব্দ করে। ৫ জনের সব আঙ্গুলের জন্য এই শব্দটি কতবার হবে?,১০০
380,যদি দুই শহরের মধ্যে দূরত্ব হয় ৮৭ মাইল। কেনেডি এই ডাইট্যান্সটি কভার করতে ৫ ঘন্টা সময় নেয়। কেনেডি ৪ রাউন্ড ট্রিপ নিতে কত ঘন্টা লাগবে?,৪০
