Q No.,Question,Answer
83,আজ আমি সকাল ১০ঃ২০ টায় এ স্কুলে যাব বলে বাড়ি থেকে বের হয়েছি। বিকাল ৪ঃ২০ টায় এ বাড়ি ফিরে এলাম। আজ আমি কত ঘন্টা বাড়ির বাহিরে ছিলাম হিসাব করি।,৬
84,দেবা কাল রাত ১০ঃ২৫ টায় শুয়ে পড়লো। কিন্তু আজ সকাল ৬ঃ২৫ টায় ঘুম থেকে উঠে পড়লো। হিসাব করে দেখি দেবা কত ঘন্টা ঘুম গেলো।,৮
85,আজ আমি আমার বাড়ির সকলের সাথে পুরী বেড়াতে যাব। ২২ঃ৩৫ -এ হাওড়া স্টেশন থেকে ট্রেন ছাড়বে। কিন্তু আমরা ২০ঃ৩৫ -এ হাওড়া স্টেশনে পৌছেঁ গেছি। হিসাব করে দেখি আমাদের স্টেশনে কত ঘন্টা অপেক্ষা করতে হবে।,২
86,বাড়ি থেকে বাসে চেপে বাবার অফিসে পৌছাঁতে ২ ঘণ্টা ২৩ মিনিট সময় লেগেছে। কিন্তু সেখান থেকে বাড়ি ফিরতে ২ ঘণ্টা ৩৭ মিনিট সময় লেগেছে। হিসাব করে দেখি যেতে ও আসতে মোট কত ঘন্টা সময় লাগল।,৫
87,(৪ ঘণ্টা ৩৩ মিনিট ) + ( ৯ ঘণ্টা ৫২ মিনিট ) = কত মিনিট?,৮৬৫
88,(৫ ঘণ্টা ১৩ মিনিট ) + ( ২ ঘণ্টা ১২ মিনিট ) = কত মিনিট?,৪৪৫
89,(২ ঘণ্টা ৪৫ মিনিট ) + ( ১ ঘণ্টা ৫২ মিনিট ) = কত মিনিট?,২৭৭
90,(৩ ঘণ্টা ৩০ মিনিট ) + ( ১ ঘণ্টা ৩১ মিনিট ) = কত মিনিট?,৩০১
91,(২ ঘণ্টা ৪৫ মিনিট ) - ( ১ ঘণ্টা ৫২ মিনিট ) = কত মিনিট?,৫৩
92,(৩ ঘণ্টা ৩০ মিনিট ) - ( ১ ঘণ্টা ৩১ মিনিট ) = কত মিনিট?,১১৯
93,(৯ ঘণ্টা ৩৩ মিনিট ) - ( ৪ ঘণ্টা ৫২ মিনিট ) = কত মিনিট?,২৮১
94,(৩ ঘণ্টা ১৩ মিনিট ) - ( ২ ঘণ্টা ১২ মিনিট ) = কত মিনিট?,৬১
95,(৪ ঘণ্টা ৩৩ মিনিট ) + ( ৯ ঘণ্টা ২৭ মিনিট ) = কত ঘন্টা?,১৪
96,(২ ঘণ্টা ১৩ মিনিট ) + ( ৪ ঘণ্টা ১৭ মিনিট ) = কত ঘন্টা?,৬.৫০
97,(১ ঘণ্টা ২৩ মিনিট ) + ( ৪ ঘণ্টা ৩৭ মিনিট ) = কত ঘন্টা?,৬
98,(৩ ঘণ্টা ২৫ মিনিট ) + ( ৮ ঘণ্টা ৩৫ মিনিট ) = কত ঘন্টা?,১২
99,(৪ ঘণ্টা ২৮ মিনিট ) + ( ৯ ঘণ্টা ৩২ মিনিট ) = কত ঘন্টা?,১৪
100,(২ ঘণ্টা ১৩ মিনিট ) - ( ২ ঘণ্টা ১২ মিনিট ) = কত মিনিট?,১
101,(৫ ঘণ্টা ৩৩ মিনিট ) - ( ১ ঘণ্টা ৩৩ মিনিট ) = কত ঘন্টা?,৪
102,একটি স্টিল মিলে এক মাসে ১২০০০ মেট্রিকটন রড তৈরি হয়। ঐ মিলে দৈনিক কী পরিমাণ রড তৈরী হয়?,৪০০
103,"একটি হোস্টেলে প্রতিদিন ৬০/৭ কুইন্টাল চাল লাগে। হোস্টেলটিতে এক সপ্তাহে কত কুইন্টাল চাল
লাগবে?",৬০
104,"একটি হোস্টেলে প্রতিদিন ১৫/৭ কুইন্টাল চাল লাগে। হোস্টেলটিতে এক সপ্তাহে কত কুইন্টাল চাল
লাগবে?",১৫
105,একটি স্টিল মিলে এক মাসে ২৪০০০ মেট্রিকটন রড তৈরি হয়। ঐ মিলে দৈনিক কী পরিমাণ রড তৈরী হয়?,৮০০
106,একটি কারখানায় একটি যন্ত্র টানা তিনদিন চলতে থাকে। যন্ত্রটি মোট কত ঘণ্টা চলে?,৭২
107,একটি কারখানায় একটি যন্ত্র টানা আড়াই দিন চলতে থাকে। যন্ত্রটি মোট কত ঘণ্টা চলে?,৬০
108,একটি কারখানায় একটি মেশিন টানা দুই সপ্তাহ চলতে থাকে। মেশিনটি মোট কত ঘণ্টা চলে?,৩৩৬
109,একটি কারখানায় একটি মেশিন টানা আড়াই সপ্তাহ চলতে থাকে। মেশিনটি মোট কত ঘণ্টা চলে?,৪২০
110,একটি কারখানায় একটি মেশিন টানা দেড় সপ্তাহ চলতে থাকে। মেশিনটি মোট কত ঘণ্টা চলে?,২৫২
111,একজন দোকানদারের কাছে তাসের নয়টি ডেক আছে। তার মোট কয়টি লাল রঙের কার্ড আছে?,২৩৪
112,"হাইকিং দলকে প্রত্যেক অংশগ্রহণকারীর জন্য গ্লাভসের ব্যবস্থা করতে হবে। যদি মোট অংশগ্রহণকারীদের সংখ্যা ৪৩ হয়, তাহলে হাইকিং দলকে সর্বনিম্ন কত সংখ্যক গ্লাভস ব্যবস্থা করতে হবে?",৮৬
113,মাতের প্রতিদিন কাজ করে এবং সাপ্তাহিক ভিত্তিতে ৭৯১ টাকা বেতন পান। মাতের যদি এই সপ্তাহে ৪ দিন কাজে না যান তবে তার বেতন কত কাটা যাবে?,৩৩৯
114,থমাস তার গাড়ী বীমা প্রতি বছর ৪ হাজার টাকা খরচ করে. এক দশকে তিনি কত হাজার টাকা খরচ করেছেন?,৪০
115,একজন দোকানদারের ৩টি সম্পূর্ণ ডেক তাস এবং একটি অতিরিক্ত ৪টি তাস রয়েছে৷ তার মোট কত কার্ড আছে?,১৬০
116,জেডেন তার ছেলেকে বলে যে আকাশে মোট ১২ টি পাখির ডানা থাকলে সেখানে কতটি পাখি থাকা উচিত?,৬
117,"পূর্ব উপকূল থেকে পশ্চিম উপকূলে একটি ২৮ ঘন্টা ট্রেন আছে। ট্রেনটি যদি মঙ্গলবার পূর্ব উপকূল থেকে খুব ভোরে যাত্রা শুরু করে, তাহলে কোন দিন গন্তব্যে পৌঁছাবে?",বুধবার
118,"স্টেডিয়ামের প্রবেশপথে বিশাল সংখ্যক প্ল্যাকার্ড একটি বিশাল ঝুড়িতে রাখা হয়। স্টেডিয়ামে প্রবেশকারী প্রত্যেক ব্যক্তি প্রতিটি হাতে একটি করে প্ল্যাকার্ড সংগ্রহ করে। বিকেল ৩টায় স্টেডিয়ামে প্রবেশ করতে শুরু করে মানুষ। কয়েক মিনিট পরে, লোকেরা অভিযোগ করে যে ঝুড়িটি খালি এবং আর কোনও প্ল্যাকার্ড নেই। যদি ঝুড়িতে ৫৬৮২টি প্ল্যাকার্ড থাকতে পারে এবং এটি শুরুতে পূর্ণ ছিল, তবে সেই সময় পর্যন্ত কত লোক স্টেডিয়ামে প্রবেশ করেছে?",২৮৪১
119,"পার্কার প্রতিদিন ৮ ঘন্টা ঘুমায়। আজ যদি তিনি সকাল ৯টায় ঘুম থেকে ওঠেন, তাহলে কতক্ষণে তিনি ঘুমোতেন?",১০
120,একটি নির্দিষ্ট প্রজাতির উদ্ভিদের উচ্চতা প্রতি দশকে ৭৫ মিটার বৃদ্ধি পায়। ৪ শতকে মোট উচ্চতা বৃদ্ধি নির্ণয় কর?,৩০০০
121,বেঞ্জামিন তার গাড়ী বীমার জন্য প্রতি বছর ৩ হাজার টাকা ব্যয় করে। এক দশকে তিনি কত হাজার খরচ করেছেন?,৩০
122,পেনেলোপ সারা বছরের জন্য প্রতিদিন ২৪ টাকা সঞ্চয় করার সিদ্ধান্ত নিয়েছে। বছরের শেষে পেনেলোপের কত টাকা সঞ্চয় হবে তা হিসাব করুন।,৮৭৬০
123,জীববিজ্ঞানের শিক্ষক লক্ষ্য করেন যে ইকরা ক্লাসে মনোযোগ দিচ্ছেন না এবং তাকে পরীক্ষাগারে পোকামাকড়ের সংখ্যা রিপোর্ট করতে বলেন যদি মোট ৫৪টি পোকার পা থাকে। ইকরা এর উত্তর কি হওয়া উচিত?,৯
124,বর্ষাকালে ব্যাঙ সর্বব্যাপী হয়ে ওঠে। এলেনা একটি পুকুরে মোট ২০টি ব্যাঙের চোখ দেখেছিল। এলেনা কয়টি ব্যাঙ দেখেছে?,১০
125,ডাক্তার আরিয়াকে একটানা ২ সপ্তাহ ধরে প্রতিদিন একটি করে আপেল খাওয়ার পরামর্শ দিয়েছেন। তার কত আপেল কিনতে হবে?,১৪
126,অ্যান্টনি এক ডজন কলা কিনেছে। সে ২টি কলা খেয়েছে। এখন কয়জন বাকি আছে?,১০
127,একটি খামারে ৩৮টি প্রাণীর পা এবং মোট ১২টি প্রাণী রয়েছে। কেউ মুরগি আবার কেউ ভেড়া। মুরগির সংখ্যা নির্ণয় কর।,৫
128,"একটি স্থানীয় ফুটবল ক্লাবের সমস্ত খেলোয়াড় ম্যাচের পরপরই তাদের মোজা ধোয়ার জন্য একটি ওয়াশিং মেশিন ব্যবহার করে। যদি ওয়াশিং মেশিনে মোট মোজার সংখ্যা ১৬ হয়, তাহলে কতজন লোক ম্যাচ খেলেছে?",৮
129,"নতুন বছরের দিনে কোচিংয়ে যোগ দেন সায়্যার। তিনি ৩ নভেম্বর পর্যন্ত প্রতিদিন কোচিং করতেন। সায়্যার কে কত কোচিং ফি দিতে হবে, যদি দৈনিক কোচিং চার্জ ৩৯ টাকা হয় এবং বছরটি লিপ ইয়ার না হয়?",১১৮৯৫
130,"কাইলি এমন একটি স্কুলে অধ্যয়ন করে যেখানে একবার ক্লাস শুরু হলে আবার ক্লাস শেষ হলে ঘণ্টা বেজে ওঠে। প্রতি ক্লাসের পর ১৫ মিনিটের বিরতি থাকে। সোমবার, কাইলির ক্লাসগুলি হল: গণিত, ইতিহাস, ভূগোল, বিজ্ঞান এবং সঙ্গীত৷ এই মুহূর্তে কায়লি তার ভূগোল ক্লাসে রয়েছে। এতক্ষণে কতবার বেজেছে?",৫
131,একটি খামারে ১৩টি পশু রয়েছে। ১৩টি প্রাণীর মধ্যে ৪টি মুরগি এবং বাকিটি মহিষ। খামারে কয়টি পশুর পা আছে?,৪৪
132,একটি খামারে ৬০টি পশুর পা এবং মোট ২০টি প্রাণী রয়েছে। কেউ মুরগি আবার কেউ ভেড়া। ভেড়ার সংখ্যা বের কর,১০
133,"মাস শেষে সাদি তার এপ্রিল মাসের খরচ হিসাব করছিলেন। তিনি দেখতে পান যে তিনি বার্গারের জন্য মোট ৪২০ টাকা ব্যয় করেছেন। যদি সাদি প্রতিদিন সমান সংখ্যক বার্গার খায়, তবে সে প্রতিদিন কত টাকার বার্গার খায়?",১৪
134,"মাস শেষে সাদি তার আগস্ট মাসের খরচ হিসাব করছিলেন। তিনি দেখতে পান যে তিনি বার্গারের জন্য মোট ৩৭২ টাকা ব্যয় করেছেন। প্রদত্ত যে সাদি প্রতিদিন সমান সংখ্যক বার্গার খায়, তবে সে প্রতিদিন কত টাকার বার্গার খায়?",১২
135,একটি পুকুরে ২০টি ব্যাঙ এবং ৬টি কুমির থাকে। প্রাণীর চোখের মোট সংখ্যা নির্ণয় করুন।,৫২
136,স্টেলা একটি ফার্মাসিউটিক্যাল কোম্পানিতে কাজ করে এবং মাসে ৪৯১৯ টাকা পায়। গত বছর তিনি ২ মাসের জন্য বিনা বেতনে ছুটি নিয়েছিলেন। গত বছর তার বার্ষিক আয় খুঁজুন।,৪৯১৯০
137,"হার্পার কাছাকাছি একটি পশু খামারে যাওয়ার সিদ্ধান্ত নেয় যেখানে মোট ১১টি প্রাণী রয়েছে। সে প্রবেশদ্বারের কাছে একটি সারিতে দাঁড়িয়ে আছে, গেট থেকে সে খামারের পশুদের পা দেখতে পেল এবং মোট পা গণনা করল ৩০টি। সে ইতিমধ্যেই জানে যে এই খামারে শুধু হাঁস এবং ঘোড়া রয়েছে। এ তথ্য থেকে ঘোড়ার সংখ্যা বের কর।",৪
138,"হার্পার কাছাকাছি একটি পশু খামারে যাওয়ার সিদ্ধান্ত নেয় যেখানে মোট ১১টি প্রাণী রয়েছে। সে প্রবেশদ্বারের কাছে একটি সারিতে দাঁড়িয়ে আছে, গেট থেকে সে খামারের পশুদের পা দেখতে পেল এবং মোট পা গণনা করল ৩০টি। সে ইতিমধ্যেই জানে যে এই খামারে শুধু হাঁস এবং ঘোড়া রয়েছে। এ তথ্য থেকে হাঁসের সংখ্যা বের কর।",৭
139,"একটি পার্কিং লটে, ১০টি গাড়ি এবং ২টি বাইক রয়েছে৷ সেই পার্কিং লটে চাকার সংখ্যা খুঁজে বের করুন।",৪৪
140,বর্গাকার একটি পার্কের চারপাশে বেড়া দেওয়া হলো এবং বেড়ার মোট খরচ ছিল ১৭২ টাকা। প্রতিটি পাশে বেড়া খরচ কত?,৪৩
141,"অলক ১২ টায় স্কুলে যায়। মঙ্গলবার, অলকের ক্লাসগুলি নিম্নলিখিত ক্রমে হয়: গণিত, ইতিহাস, ভূগোল, বিজ্ঞান এবং সঙ্গীত। এইমাত্র অলকের বিজ্ঞানের ক্লাস শেষ হয়েছে। এখন বিকালের সময় কত?",৪
142,"মাসের শেষে, হাডসন তার ডিসেম্বরের খরচ হিসাব করছিলেন। তিনি দেখতে পান যে তিনি বার্গারের জন্য মোট ৪৬৫ টাকা ব্যয় করেছেন। প্রদত্ত যে হাডসন প্রতিদিন সমান সংখ্যক বার্গার খায়, তবে সে প্রতিদিন কত টাকার বার্গার খায়?",১৫
143,ম্যাসন প্রতিদিন পাঁচ পয়সা সঞ্চয় করতে শুরু করেন। কত দিনে তিনি মোট ৩ টাকা সঞ্চয় করতেন?,৬০
144,"একটি ফুটবল খেলায়, প্রত্যেক দর্শককে তাদের উভয় হাতের জন্য রিস্টব্যান্ড দেওয়া হত। মোট ২৫০টি রিস্টব্যান্ড বিতরণ করা হয়েছে। কত মানুষ খেলা দেখেছেন?",১২৫
145,প্রতিদিন শার্লট তার ফোনে ১৬ ঘন্টা ব্যয় করে। এই সময়ের অর্ধেক যদি ব্যয় হয় সোশ্যাল মিডিয়ায়। এক সপ্তাহে তিনি কতটা সময় সোশ্যাল মিডিয়ায় ব্যয় করেন,৫৬
146,মায়া প্রতিদিন চারটি করে পয়সা সঞ্চয় করতে লাগলো। কত দিনে তিনি মোট ৫ টাকা সঞ্চয় করতেন?,১২৫
147,"পাইপার একটি বায়ু প্রদর্শনীতে রাখা সমস্ত বাণিজ্যিক বিমানের ডানা গণনা করেছে। মোট ডানা ৯০টি হলে, কতটি প্লেন ছিল?",৪৫
148,আভা এবং সারা দাবা খেলার সিদ্ধান্ত নিয়েছে কিন্তু দেখতে পেল যে ১০ টি টুকরো নেই। কত টুকরা উপস্থিত ছিল?,২২
149,"আভা একটি কাছাকাছি পশু খামারে যাওয়ার সিদ্ধান্ত নেয় যেখানে মোট ৯টি প্রাণী রয়েছে। সে প্রবেশদ্বারের কাছে একটি সারিতে দাঁড়িয়ে আছে, গেট থেকে সে খামারের পশুদের পা দেখতে পেল এবং সে গণনা করে মোট পা সংখ্যা ২৬টি। সে ইতিমধ্যেই জানে যে এই খামারে শুধু মুরগি এবং মহিষ রয়েছে। এ তথ্য থেকে মহিষের সংখ্যা বের কর।",৪
150,"আভা একটি কাছাকাছি পশু খামারে যাওয়ার সিদ্ধান্ত নেয় যেখানে মোট ৯টি প্রাণী রয়েছে। সে প্রবেশদ্বারের কাছে একটি সারিতে দাঁড়িয়ে আছে, গেট থেকে সে খামারের পশুদের পা দেখতে পেল এবং সে গণনা করে মোট পা সংখ্যা ২৬টি। সে ইতিমধ্যেই জানে যে এই খামারে শুধু মুরগি এবং মহিষ রয়েছে। এ তথ্য থেকে মুরগির সংখ্যা বের কর।",৫
151,রবার্ট জানুয়ারি মাসে জিআরই এন্ট্রান্স পরীক্ষার প্রস্তুতি শুরু করেন। ৪ তারিখে লিখিত পরীক্ষা পর্যন্ত রবার্ট প্রস্তুতি নেন। রবার্ট কোন মাসের জন্য প্রস্তুতি নেন?,মে
152,"নোহা প্রতি মাসে ৩ বার একজন ডাক্তারের কাছে যাওয়ার কথা। সুতরাং, তিনি সারা বছর ধরে প্রতি মাসে ৩টি ছুটি নিয়েছিলেন। সেই বছরে নোহা কত ছুটি নিয়েছিলেন",৩৬
153,ভিক্টোরিয়া ৯৫ মি/সেকেন্ড গতিতে চলে। সে ২ মিনিটে কত কিমি অতিক্রম করতে পারে,১১.৪০
154,ক্যারোলিন এক ফুট লম্বা বার্গার কিনে তার ভাইয়ের সাথে অর্ধেক ভাগ করে নিল। প্রতিজন কত ইঞ্চি ভাগ পাবে?,৬
155,"সান্তিয়াগো জানুয়ারী মাসে তার নিজ দেশ ছেড়েছিলেন, ডিসেম্বরে একই তারিখে ফিরে আসার আগে কয়েক মাস অস্ট্রেলিয়ায় ছিলেন। সান্তিয়াগো কত মাস অস্ট্রেলিয়ায় ছিলেন?",১১
156,ব্রুকলিন প্রতি মাসে দাতব্য প্রতিষ্ঠানে ১৪৫৩ টাকা দান করে। এক বছরে তার মোট দানের হিসাব করুন।,১৭৪৩৬
157,"পুরো মার্চ মাসের জন্য, আরিয়া প্রতিদিন ৪টি কুকি কিনেছে। প্রতিটি কুকির দাম ১৯ টাকা হলে। আরিয়া মার্চ মাসে কুকিতে কত খরচ করেছে",২৩৫৬
158,ইজেকিয়েল থ্যাঙ্কসগিভিং সেলের সময় ৩ জোড়া জুতা কিনেছিলেন। এখন তার মোট নতুন জুতা সংখ্যা কতটি?,৬
159,ভিভিয়ান তার গাড়ির বীমার জন্য প্রতি বছর ২ হাজার টাকা খরচ করে। এক দশকে তিনি কত হাজার খরচ করেছেন?,২০
160,সকাল ৭টা থেকে বিকেল ৪টা পর্যন্ত টানা ৪ ঘণ্টা বৃষ্টি হয়েছে। কত ঘণ্টা বৃষ্টি হয়নি?,৫
161,"কেনেডি এবং রিলি একটি দাবা খেলা খেলছেন, তারা যথাক্রমে ৫ এবং ১ পেয়াদা হারিয়েছে। গেমটিতে বাকি থাকা পেয়াদার মোট সংখ্যা খুঁজুন",১১
