Q No.,Question,Answer
1,করিম একজন ১৪ বছরের ছেলে। তার দুটি হাতে মোট কতটি আঙুল?,১০
2,৫ জন মেয়ে ও ৫ জন ছেলে হ্যান্ডবল খেলছে। তাদের ডান হাতে মোট কয়টি আঙ্গুল আছে?,৫০
3,পাঁচ ডজন ডিমের মধ্যে কয় হালি ডিম আছে? ,১৫
4,একটা ছেলে একটা মাঠে ৫টা গরু চড়াচ্ছে। ঐখানে মোট কয়টা পা আছে?,২২
5,একটি কোম্পানি প্রতিদিন ৭০ ইউনিট পণ্য উত্পাদন করে। যদি তারা জানুয়ারী মাসে ৫ দিন কাজ বন্ধ রাখে তবে তারা জানুয়ারী মাসে কত ইউনিট উত্পাদন করবে?,১৮২০
6,একজন দোকানদারের কাছে তাস খেলার ৭টি ডেক রয়েছে। তার মোট কয়টি লাল রঙের কার্ড আছে?,১৮২
7,কপিরাইট সমস্যার কারণে এক ঘণ্টার মুভির ১৫ মিনিটের একটি দৃশ্য কাটা হয়েছে। সিনেমার চূড়ান্ত দৈর্ঘ্য কত (মিনিটের মধ্যে)?,৪৫
8,আব্দুল্লাহ তার ছেলেকে বলে যে আকাশে যদি মোট ২০টি পাখির ডানা থাকে তবে সেখানে কতটি পাখি থাকা উচিত?,১০
9,আব্দুল্লাহ তার স্ত্রীর প্রতিটি তর্জনীর জন্য একটি সোনার আংটি কিনতে চায়। যদি একটি আংটির দাম ২ লক্ষ টাকা হয় তবে আব্দুল্লাহকে কত লক্ষ টাকা দিতে হবে?,৪
10,করিম একজন ১৮ বছরের ছেলে। তার হাতে তর্জনী আঙুল নেই। তার দুটি হাতে মোট কতটি আঙুল?,৮
11,করিম একজন ১৮ বছরের ছেলে। তার ডান হাতের বুড়ো আঙুল ও বাম হাতের  তর্জনী নেই। তার দুটি হাতে মোট কতটি আঙুল?,৮
12,একটি পুকুরে ২০টি ব্যাঙ এবং ১০টি কুমির থাকে। প্রাণীর মোট চোখের সংখ্যা নির্ণয় করুন।,৬০
13,৭ জন মেয়ের একটি দল নেইল পলিশ করার জন্য একটি স্পাতে গিয়েছিল। যদি প্রতিটি মেয়ের পায়ের সমস্ত আঙ্গুল পালিশ করা হয়। স্পা কর্মীদের পালিশ করা মোট আঙ্গুলের সংখ্যা কত?,৭০
14,১৩ জন মেয়ের একটি দল নেইল পলিশ করার জন্য একটি স্পাতে গিয়েছিল। যদি প্রতিটি মেয়ের হাতের আঙ্গুল পালিশ করা হয়। স্পা কর্মীদের পালিশ করা মোট আঙ্গুলের সংখ্যা কত?,১৩০
15,৪ জন মেয়ের একটি দল নেইল পলিশ করার জন্য একটি স্পাতে গিয়েছিল। যদি প্রতিটি মেয়ের পায়ের সমস্ত আঙ্গুল পালিশ করা হয়। স্পা কর্মীদের পালিশ করা মোট আঙ্গুলের সংখ্যা কত?,৪০
16,আবির দোকান থেকে সাড়ে চার ডজন ডিম নিয়ে বাসায় গেল। বাসায় গিয়ে সে দেখল ৫ টা ডিম নষ্ট। তবে আবিরের কাছে কয়টা ভাল ডিম আছে?,৪৯
17,আবির দোকান থেকে তিন ডজন ডিম নিয়ে বাসায় গেল। বাসায় গিয়ে সে দেখল ৮ টা ডিম নষ্ট। তবে আবিরের কাছে কয়টা ভাল ডিম আছে?,২৮
18,আবির দোকান থেকে আধা ডজন ডিম নিয়ে বাসায় গেল। বাসায় গিয়ে সে দেখল ২ টা ডিম নষ্ট। তবে আবিরের কাছে কয়টা ভাল ডিম আছে?,৪
19,আবির দোকান থেকে দেড় ডজন ডিম নিয়ে বাসায় গেল। বাসায় গিয়ে সে দেখল ৪ টা ডিম নষ্ট। তবে আবিরের কাছে কয়টা ভাল ডিম আছে?,১৪
20,আবির দোকান থেকে আড়াই ডজন ডিম নিয়ে বাসায় গেল। বাসায় গিয়ে সে দেখল ৩ টা ডিম নষ্ট। তবে আবিরের কাছে কয়টা ভাল ডিম আছে?,২৭
21,রফিক দোকান থেকে সাড়ে পাঁচ ডজন ডিম নিয়ে বাসায় গেল। বাসায় গিয়ে সে দেখল ৭ টা ডিম নষ্ট। তবে রফিকের কাছে কয়টা ভাল ডিম আছে?,৫৯
22,রফিক দোকান থেকে ডজন প্রতি ১৪৪ টাকা দিয়ে আধা ডজন ডিম নিয়ে বাসায় গেল। বাসায় গিয়ে সে দেখল ৩ টা ডিম নষ্ট। তবে রফিকের কত টাকা খরচ হল?,৭২
23,রফিক দোকান থেকে ডজন প্রতি ১৪৪ টাকা দিয়ে আড়াই ডজন ডিম নিয়ে বাসায় গেল। বাসায় গিয়ে সে দেখল ৪ টা ডিম নষ্ট। তবে রফিকের কত টাকা খরচ হল?,৩৬০
24,রফিক দোকান থেকে ডজন প্রতি ১২০ টাকা দিয়ে দেড় ডজন ডিম নিয়ে বাসায় গেল। বাসায় গিয়ে সে দেখল ৬ টা ডিম নষ্ট। তবে রফিকের কত টাকা খরচ হল?,১৮০
25,রফিক দোকান থেকে ডজন প্রতি ১৩২ টাকা দিয়ে আধা ডজন ডিম নিয়ে বাসায় গেল। বাসায় গিয়ে সে দেখল ২ টা ডিম নষ্ট। তবে রফিকের কত টাকা খরচ হল?,৬৬
26,রফিক দোকান থেকে ডিম প্রতি ১৪ টাকা করে আধা ডজন ডিম নিয়ে বাসায় গেল। বাসায় গিয়ে সে দেখল ৩ টা ডিম নষ্ট। তবে রফিকের কত টাকা খরচ হল?,৮৪
27,রফিক দোকান থেকে ডিম প্রতি ১২ টাকা করে আড়াই ডজন ডিম নিয়ে বাসায় গেল। বাসায় গিয়ে সে দেখল ৪ টা ডিম নষ্ট। তবে রফিকের কত টাকা খরচ হল?,৩৬০
28,রফিক দোকান থেকে ডিম প্রতি ১১ টাকা করে দেড় ডজন ডিম নিয়ে বাসায় গেল। বাসায় গিয়ে সে দেখল ২ টা ডিম নষ্ট। তবে রফিকের কত টাকা খরচ হল?,১৯৮
29,রফিক দোকান থেকে ডিম প্রতি ৯ টাকা করে আধা ডজন ডিম নিয়ে বাসায় গেল। তবে রফিকের কত টাকা খরচ হল?,৫৪
30,রফিক দোকান থেকে ডিম প্রতি ৭ টাকা করে সাড়ে চার ডজন ডিম নিয়ে বাসায় গেল। তবে রফিকের কত টাকা খরচ হল?,৩৭৮
31,রফিক দোকান থেকে ডিম প্রতি ১১ টাকা করে আড়াই ডজন ডিম নিয়ে বাসায় গেল। তবে রফিকের কত টাকা খরচ হল?,৩৩০
32,জামাল দোকান থেকে ডিম প্রতি ১০ টাকা করে সাড়ে ছয় হালি ডিম নিয়ে বাসায় গেল। তবে জামালের কত টাকা খরচ হল?,২৬০
33,জামাল দোকান থেকে ডিম প্রতি ১১ টাকা করে সাড়ে তিন হালি ডিম নিয়ে বাসায় গেল। তবে জামালের কত টাকা খরচ হল?,১৫৪
34,জামাল দোকান থেকে ডিম প্রতি ৫ টাকা করে সাড়ে চার হালি ডিম নিয়ে বাসায় গেল। তবে জামালের কত টাকা খরচ হল?,৯০
35,জামাল দোকান থেকে ডিম প্রতি ৯ টাকা করে আড়াই হালি ডিম নিয়ে বাসায় গেল। তবে জামালের কত টাকা খরচ হল?,৯০
36,জামাল দোকান থেকে ডিম প্রতি ৭ টাকা করে আড়াই হালি ডিম নিয়ে বাসায় গেল। তবে জামালের কত টাকা খরচ হল?,৭০
37,জামাল দোকান থেকে ডিম প্রতি ১২ টাকা করে দেড় হালি ডিম নিয়ে বাসায় গেল। তবে জামালের কত টাকা খরচ হল?,৭২
38,রফিক দোকান থেকে ডিম প্রতি ১০ টাকা করে সাড়ে ছয় ডজন ডিম নিয়ে বাসায় গেল। তবে রফিকের কত টাকা খরচ হল?,৭৮০
39,রফিক দোকান থেকে ডিম প্রতি ১৪ টাকা করে আধা ডজন ডিম নিয়ে বাসায় গেল। বাসায় গিয়ে সে দেখল ৬ টা ডিম নষ্ট। তবে রফিকের কত টাকার ডিম নষ্ট হল না?,০
40,রফিক দোকান থেকে ডিম প্রতি ৩৩ টাকা করে আড়াই ডজন ডিম নিয়ে বাসায় গেল। বাসায় গিয়ে সে দেখল ৪ টা ডিম নষ্ট। তবে রফিকের কত টাকার ডিম নষ্ট হল না?,৮৫৮
41,রফিক দোকান থেকে ডজন প্রতি ১৪৪ টাকা দিয়ে আধা ডজন ডিম নিয়ে বাসায় গেল। বাসায় গিয়ে সে দেখল ৩ টা ডিম নষ্ট। তবে রফিকের কত টাকা ক্ষতি হল?,৩৬
42,তাহসান দোকান থেকে ডজন প্রতি ১৪৪ টাকা দিয়ে দেড় ডজন ডিম নিয়ে বাসায় গেল। বাসায় গিয়ে সে দেখল ৫ টা ডিম নষ্ট। তবে তাহসানের কত টাকার ডিম নষ্ট হল না?,১৫৬
43,তাহসান দোকান থেকে ডজন প্রতি ১৪৪ টাকা দিয়ে আড়াই ডজন ডিম নিয়ে বাসায় গেল। বাসায় গিয়ে সে দেখল ৮ টা ডিম নষ্ট। তবে কত টাকার ডিম নষ্ট হল না?,২৬৪
44,তাহসান দোকান থেকে ডজন প্রতি ১৪৪ টাকা দিয়ে সাড়ে পাঁচ ডজন ডিম নিয়ে বাসায় গেল। বাসায় গিয়ে সে দেখল ৩ টা ডিম নষ্ট। তবে তাহসানের কত টাকা ক্ষতি হল?,৩৬
45,তাহসান দোকান থেকে ডজন প্রতি ১২০ টাকা দিয়ে আড়াই ডজন ডিম নিয়ে বাসায় গেল। বাসায় গিয়ে সে দেখল ৩ টা ডিম নষ্ট। তবে তাহসানের কত টাকা ক্ষতি হল?,৩০
46,তাহসান দোকান থেকে ডজন প্রতি ১২০ টাকা দিয়ে দেড় ডজন ডিম নিয়ে বাসায় গেল। বাসায় গিয়ে সে দেখল ৫ টা ডিম নষ্ট। তবে তাহসানের কত টাকা ক্ষতি হল?,৫০
47,তাহসান দোকান থেকে ডজন প্রতি ১২০ টাকা দিয়ে সাড়ে তিন ডজন ডিম নিয়ে বাসায় গেল। বাসায় গিয়ে সে দেখল ৮ টা ডিম নষ্ট। তবে তাহসানের কত টাকা ক্ষতি হল?,৮০
48,তাহসান দোকান থেকে ডজন প্রতি ১৩২ টাকা দিয়ে আধা ডজন ডিম নিয়ে বাসায় গেল। বাসায় গিয়ে সে দেখল ৬ টা ডিম নষ্ট। তবে তাহসানের কত টাকা ক্ষতি হল?,৬৬
49,তাহসান দোকান থেকে ১৩২ টাকা দিয়ে এক ডজন ডিম নিয়ে বাসায় গেল। বাসায় গিয়ে সে দেখল ৩ টা ডিম নষ্ট। তবে তাহসানের কত টাকা ক্ষতি হল?,৩৩
50,অশিমের দোকানে ৩০ ডজন ডিম আছে। অশিম প্রতি ডজন ডিম ১৪৪ টাকা করে বিক্রি করে। প্রান্তিক অশিমের দোকান থেকে মোট ডিমের ২৫% ক্রয় করলে প্রান্তিকের কত টাকা বিল দিতে হবে?,১০৮০
51,অশিমের দোকানে ২০ ডজন ডিম আছে। অশিম প্রতিটি ডিম ১০ টাকা করে বিক্রি করে। প্রান্তিক অশিমের দোকান থেকে মোট ডিমের ৭৫% ক্রয় করলে প্রান্তিকের কত টাকা বিল দিতে হবে?,১৮০০
52,অশিমের দোকানে ৫০ ডজন ডিম আছে। অশিম প্রতি ডজন ডিম ১২০ টাকা করে বিক্রি করে। প্রান্তিক অশিমের দোকান থেকে মোট ডিমের ৭৫% ক্রয় করলে প্রান্তিকের কত টাকা বিল দিতে হবে?,৪৫০০
53,"একটি এলাকায় ৩০০ জন মানুষ আছে, যাদের প্রত্যেকের ১ টি করে পোষা কুকুর আছে। যদি এলাকার সবাই একসাথে একটি মাঠে তাদের কুকুর নিয়ে উপস্থিত হয়। তবে ওই মুহূর্তে ওই মাঠে মোট কয়টি পা থাকবে?",১৮০০
54,"একটি এলাকায় ৮০ জন মানুষ আছে, যাদের প্রত্যেকের ২ টি করে পোষা কুকুর আছে। যদি এলাকার সবাই একসাথে একটি মাঠে তাদের কুকুর নিয়ে উপস্থিত হয়। তবে ওই মুহূর্তে ওই মাঠে মোট কয়টি পা থাকবে?",৮০০
55,"একটি এলাকায় ১২০ জন মানুষ আছে, যাদের প্রত্যেকের ২ টি করে পোষা কুকুর আছে। যদি এলাকার সবাই একসাথে একটি মাঠে তাদের কুকুর নিয়ে উপস্থিত হয়। তবে ওই মুহূর্তে ওই মাঠে মোট কয়টি পা থাকবে?",১২০০
56,"একটি এলাকায় ১০০ জন মানুষ আছে, যাদের প্রত্যেকের ১ টি করে পোষা কুকুর আছে। যদি এলাকার সবাই একসাথে একটি মাঠে তাদের কুকুর নিয়ে উপস্থিত হয়। তবে ওই মুহূর্তে ওই মাঠে মোট কয়টি পা থাকবে?",৬০০
57,আসিফের খামারে মোট ১২৩ টি গরু ও ৪৫ টি ছাগল আছে । তার খামারের পশুগুলোর মোট কয়টি পা আছে?,৬৭২
58,আসিফের খামারের পশুগুলোর মোট ৪৬০ টি পা আছে। তার খামারে মোট কত গুলা গরু আছে?,১১৫
59,অশিমের দোকানে ৭০ ডজন ডিম আছে। আশিম প্রতি ডজন ডিম ২৪০ টাকা করে বিক্রি করে। প্রান্তিক অশিমের দোকান থেকে মোট ডিমের ৩০% ক্রয় করলে প্রান্তিকের কত টাকা বিল দিতে হবে?,৫০৪০
60,ফেব্রুয়ারি মাসের ৩০ তারিখ জিসানের জন্মদিন হওয়ার সম্ভাবনা কত?,০
61,আবিরের মা বললো জিসানের জন্ম এপ্রিল মাসের পরের মাসে কিন্তু আবির জিসানের থেকে এক মাসের বড়। মে মাসে  জিসানের জন্মদিন হওয়ার সম্ভাবনা কত?,১
62,আবিরের মা বললো জিসানের জন্ম এপ্রিল মাসের পরের মাসে কিন্তু আবির জিসানের থেকে এক মাসের বড়। জুন মাসে জিসানের জন্মদিন হওয়ার সম্ভাবনা কত?,০
63,আবিরের মা বললো জিসানের জন্ম এপ্রিল মাসের পরের মাসে কিন্তু আবির জিসানের থেকে এক মাসের বড়। মে মাসে আবিরের জন্মদিন হওয়ার সম্ভাবনা কত?,০
64,আবিরের মা বললো জিসানের জন্ম এপ্রিল মাসের পরের মাসে কিন্তু আবির জিসানের থেকে এক মাসের বড়। এপ্রিল মাসে আবিরের জন্মদিন হওয়ার সম্ভাবনা কত?,১
65, জিসানের জন্মদিন মার্চ মাসে হলে। মার্চ মাসের ৩১ তারিখ জিসানের জন্মদিন হওয়ার সম্ভাবনা কত?,১/৩১
66,মে মাসের ৩৩ তারিখ জিসানের জন্মদিন হওয়ার সম্ভাবনা কত?,০
67,জুন মাসের ৩১ তারিখ জিসানের জন্মদিন হওয়ার সম্ভাবনা কত?,০
68,সেপ্টেম্বর মাসের ৩১ তারিখ জিসানের জন্মদিন হওয়ার সম্ভাবনা কত?,০
69,এপ্রিল মাসের ৩১ তারিখ জিসানের জন্মদিন হওয়ার সম্ভাবনা কত?,০
70,একটি কারখানায় ৩ দিনে ৩৩৯টি মোটরসাইকেল তৈরি হয়। ৪ সপ্তাহে ওই কারখানায় কতটি মোটরসাইকেল তৈরি হবে।,৩১৬৪
71,একটি কারখানায় ৫ দিনে ২৪৫০টি মোটরসাইকেল তৈরি হয়। ৫ সপ্তাহে ওই কারখানায় কতটি মোটরসাইকেল তৈরি হবে।,১৭১৫০
72,একটি কারখানায় ৫ দিনে ৫০০টি মোটরসাইকেল তৈরি হয়। ৩ সপ্তাহে ওই কারখানায় কতটি মোটরসাইকেল তৈরি হবে।,২১০০
73,একটি কারখানায় ২ দিনে ৩৬০টি মোটরসাইকেল তৈরি হয়। ৫ সপ্তাহে ওই কারখানায় কতটি মোটরসাইকেল তৈরি হবে।,৬৩০০
74,একটি কারখানায় ৩ দিনে ৯০০টি মোটরসাইকেল তৈরি হয়। ৪ সপ্তাহে ওই কারখানায় কতটি মোটরসাইকেল তৈরি হবে।,৮৪০০
75,একটি কারখানায় ৩ দিনে ১৫০০টি মোটরসাইকেল তৈরি হয়। ৬ সপ্তাহে ওই কারখানায় কতটি মোটরসাইকেল তৈরি হবে।,২১০০০
76,একটি কারখানায় ২ দিনে ৪৫০টি মোটরসাইকেল তৈরি হয়। ৪ সপ্তাহে ওই কারখানায় কতটি মোটরসাইকেল তৈরি হবে।,৬৩০০
77,একটি কারখানায় ৫ দিনে ২৪৫০টি মোটরসাইকেল তৈরি হয়। ৪ সপ্তাহে ওই কারখানায় কতটি মোটরসাইকেল তৈরি হবে।,১৩৭২০
78,মিনা ৪ মিনিটে ২০০ মিটার হাঁটে। আধা ঘন্টায় সে কত মিটার হাটতে পারবে?,১৫০০
79,"২টি ঘণ্টা আছে। একটি ১২ মিনিট পরপর এবং অপরটি ৫ মিনিট পরপর বাজে। যদি ঘণ্টা ২টি একসাথে বিকাল ৩ টার সময় বাজে, বিকাল কয়টায় পুনরায় একসাথে বাজবে?",৪
80,"একটি বাস স্টেশন থেকে ক কোম্পানির বাস ১৫ মিনিট পরপর এবং খ কোম্পানির বাস ২৫ মিনিট পরপর ছাড়ে। যদি সকাল ৮:৪৫ এ দুইটি কোম্পানির বাস একসাথে ছাড়ে, পরবর্তীতে সকালে কয়টায় পুনরায় একসাথে ছাড়বে?",১০
81,একজন শিক্ষক ৪০ জন ছাত্র এবং ২৪ জন ছাত্রীকে কতগুলো দলে ভাগ করে দিলেন যেন প্রত্যেক দলে ছাত্র ও ছাত্রীর সংখ্যা সমান থাকে এবং কোনো শিক্ষার্থী অবশিষ্ট না থাকে। সর্বোচ্চ কতটি দলে ভাগ করা যাবে এবং প্রতি দলে কতজন ছাত্র এবং ছাত্রী থাকবে তা নির্ণয় কর।,১২০
82,"তিনটি ভিন্ন রং এর ঘণ্টা আছে। লাল রং এর ঘন্টা ১৮ মিনিট পরপর, হলুদ রং এর ঘণ্টা ১৫ মিনিট পরপর এবং সবুজ রং এর ঘন্টা ১২ মিনিট পরপর বাজে। ঘণ্টাগুলো সন্ধ্যা ৬টায় একসাথে বাজলে, রাত কয়টায় পুনরায় কখন একসাথে বাজবে ?",৯
